{
  "$schema": "../../../schemas/scene-recipe.schema.json",
  "schema_version": "1.0.0",
  "recipe_id": "instagram_white_neutral_overhead_spatial_recipe_v1",
  "display_name": "화이트 원형 테이블과 타일 바닥의 공간감 항공샷",
  "compatible_presets": ["instagram_white_neutral_overhead_spatial_v1"],
  "generation_policy": {
    "normal_paid_generations": 1,
    "runtime_reference_image": false,
    "traditional_compositing": false
  },
  "composition": {
    "inherit_preset_bbox": true,
    "subject_anchor_priority": "one complete product sits just below center on the right-dominant round white table; keep the table edge and the left floor wedge visible",
    "asymmetry_sources": [
      "large circular table entering from the right",
      "narrow gray tiled-floor wedge on the left",
      "broad partial shadows cast by unseen room elements"
    ]
  },
  "environment": {
    "background_plane": "one large matte warm-neutral white circular tabletop above a gray tiled cafe floor visible only as a narrow left wedge",
    "surface_character": "plain lightly textured matte white table; no fabric weave, coaster, napkin, paper or decorative prop",
    "sun_patch_shape": "broad irregular soft-edged tonal patches from off-frame window obstructions, never a crisp leaf or furniture silhouette"
  },
  "lighting": {
    "source": "one large upper-left window diffused by room air and partial off-frame architecture or furniture",
    "direction": "upper left toward lower right",
    "shadow_description": "a compact attached product shadow plus broad low-density environmental shadows crossing both floor and table from objects outside the frame",
    "light_softness": [0.58, 0.76],
    "subject_to_wall_distance_cm": [40, 90],
    "shadow_density": [0.16, 0.34],
    "global_contrast": [0.28, 0.44],
    "background_lightness": [0.72, 0.9],
    "ambient_fill": "neutral room bounce that keeps white-table texture and gray-floor depth readable",
    "exposure_compensation_ev": [-0.18, 0.02],
    "sun_patch_coverage": [0.18, 0.38],
    "highlight_behavior": "soft protected white highlights with table texture, cup rim and beverage surface retained",
    "shadow_temperature": "neutral to faintly cool relative to the warm-neutral table"
  },
  "capture": {
    "phone_hdr": "restrained natural social-photo HDR",
    "shadow_processing": "retain the spatial separation between elevated tabletop, receding floor and off-frame room volume",
    "local_texture": "retain ceramic or source-container construction, beverage identity, ice and toppings without artificial microcontrast",
    "forbidden_processing": [
      "uniform Gaussian blur",
      "portrait-mode cutout",
      "oversharpening",
      "milky lifted blacks",
      "seamless studio sweep",
      "cinematic grade"
    ]
  },
  "human_rendering": {
    "skin_texture": "not applicable because no hand is active",
    "light_response": "not applicable because no hand is active",
    "forbidden": ["hand", "finger", "wrist", "arm", "sleeve"]
  },
  "material_rules": {
    "glass": "in source-family mode rebuild a simple glass in the same broad family and material under the target overhead camera; exact source height, taper, sidewall geometry and branding are not invariants. In adopt-reference mode reconstruct only the versioned opaque white ceramic mug. Keep rim, ice, liquid and attached shadow physically connected",
    "plastic": "in source-family mode rebuild a simple plastic cup in the same broad family and material under the target overhead camera and never add an unverified lid or straw; in adopt-reference mode obey the separate versioned opaque ceramic container contract"
  },
  "coupling_rules": [
    "Product, table, floor and environmental shadows belong to one upper-left window exposure.",
    "The curved table edge and receding floor grout jointly communicate camera height and room depth.",
    "The product stays fully on the table and owns one attached contact shadow.",
    "Only the declared cup design may transfer; reference beverage, latte art, exact shadow silhouette and exact pixel layout are excluded."
  ],
  "forbidden": [
    "fabric, coaster, napkin, saucer or placemat",
    "bread, spoon, flower, book, phone or decorative prop",
    "visible chair, plant or furniture body",
    "flat white seamless background with no floor wedge",
    "crisp graphic sunlight or copied shadow silhouette",
    "copied reference coffee, crema or latte art",
    "invented text, logo or watermark"
  ],
  "quality_gate": {
    "hard_fail": [
      "the round table edge or left gray floor wedge disappears",
      "floor grout does not recede or the table reads as a flat background",
      "broad off-frame environmental shadow atmosphere is absent",
      "fabric, coaster, napkin, saucer or decorative prop appears",
      "product is cropped, floats or lacks an attached contact shadow",
      "reference coffee, latte art, text or exact shadow silhouette leaks",
      "product inherits the oblique source camera instead of the target overhead camera",
      "cup rim is strongly elliptical or too much sidewall is visible",
      "beverage color, syrup or fruit appears on an opaque cup exterior or base"
    ],
    "weights": {
      "natural_smartphone_capture": 0.15,
      "instagram_composition": 0.24,
      "product_identity": 0.2,
      "lighting_physical_coherence": 0.2,
      "color_and_tone": 0.13,
      "novel_scene_distance": 0.08
    }
  }
}
